uuid,Void/Retire,Same as mappings,Fully specified name:en,Short name:en,Description:en,Data class,Data type,Complex data handler,Answers,Members,Allow decimals,Units,Normal low,Normal high,Absolute low,Absolute high,_version:1,_order:1300
b4b46577-2a99-49a2-996d-fc3d8f4d5931,,,Bed assignment,Bed assignment,,Misc,Coded,,Medical Surgical; Telemetry; Stepdown; Intensive care,,,,,,,,,
4b29f87b-b7a2-4b2e-9e7b-41dc94ddd848,,,Code status,Code status,,Misc,Coded,,Full code; DNR; Comfort measures ,,,,,,,,,
447d00c1-e2ca-4ae6-96bc-ac656089a20b,,,Vitals,Vitals,,Misc,Coded,,Per shift; q4 hrs; q2 hrs,,,,,,,,,
373d170f-4b22-4071-8ac7-e106604f80f4,,,Activity,Activity,,Misc,Coded,,Strict bedrest; Bedrest with bathroom privileges; Bed to chair; Activity as tolerated,,,,,,,,,
3c8cebe7-19eb-4e54-8eec-1bd2656b5a13,,,Nursing orders,Nursing orders,,Misc,Coded,,Strict I&Os; Daily weights; Neuro checks; Elevate head of bed; Bedside swallow eval,,,,,,,,,
6c1babb0-8022-4bd4-ade4-562520de5297,,,Diet,Diet,,Misc,Coded,,NPO; Clear liquid diet; Cardiac diet; Renal diet; Diabetic diet; Regular diet,,,,,,,,,
ffb8a077-3134-4de0-9f79-9f566f526d63,,,Medications,Medications,,Misc,Coded,,Perform medication reconciliation,,,,,,,,,
